{
  "_id": "27cc67093475061e3d95369d",
  "name": "ABC, Inc.",
  "other_names": [
    {
      "name": "Bob's Diner",
      "start_date": "1950-01-01",
      "end_date": "1954-12-31"
    },
    {
      "name": "Joe's Diner",
      "start_date": "1955-01-01"
    },
    {
      "name": "Famous Joe's"
    }
  ],
  "identifiers": [
    {
      "identifier": "123456789",
      "scheme": "DUNS"
    },
    {
      "identifier": "US0123456789",
      "scheme": "ISIN"
    }
  ],
  "classifications": [
    {
      "classification": "Corporation"
    },
    {
      "classification": "Fast-food chain"
    }
  ],
  "parent_id": "17cc67093475061e3d95369d",
  "founding_date": "1950-01-01",
  "dissolution_date": "2000-01-01"
}
